{
  "schema_version": 1,
  "profile": "DEVELOPMENT",
  "stack": "Electron 44.5.1 / Node 24.21.0 / JS ES modules / Workflow Kit donor 1.7.2 / Codex App Server",
  "checks": [
    {
      "required": false,
      "timeout_ms": 600000,
      "id": "unit-all",
      "kind": "test",
      "executable": "npm",
      "args": [
        "test"
      ],
      "evidence": "Полная перенесённая Node suite; адаптация путей/identity не ослабляет assertions."
    },
    {
      "required": false,
      "timeout_ms": 600000,
      "id": "electron-smoke",
      "kind": "test",
      "executable": "npm",
      "args": [
        "run",
        "smoke"
      ],
      "evidence": "Изолированный Electron TEST FIXTURE без реальных служб/модельных запросов; не заменяет живую проверку."
    },
    {
      "required": false,
      "timeout_ms": 600000,
      "id": "kit-check",
      "kind": "test",
      "executable": "npm",
      "args": [
        "run",
        "check:core",
        "--prefix",
        "packages/workflow-kit"
      ],
      "evidence": "Первая обязательная часть полного Kit: пакет, consumer/runtime/recovery, carryover, Review и план. Выполнять вместе с kit-assignments."
    },
    {
      "required": false,
      "timeout_ms": 600000,
      "id": "kit-assignments",
      "kind": "test",
      "executable": "npm",
      "args": [
        "run",
        "check:assignments",
        "--prefix",
        "packages/workflow-kit"
      ],
      "evidence": "Вторая обязательная часть полного Kit: handoff, назначения, интеграции, оркестрация и upgrade. Выполнять вместе с kit-check."
    },
    {
      "required": false,
      "timeout_ms": 180000,
      "id": "executor-channel",
      "kind": "test",
      "executable": "node",
      "args": [
        "--test",
        "tests/codex-app-server-mcp.test.mjs"
      ],
      "evidence": "Настоящий Codex App Server без модельных ходов, каталог и контракты инструментов; временный workspace."
    },
    {
      "required": false,
      "timeout_ms": 180000,
      "id": "codex-tools-live",
      "kind": "test",
      "executable": "npm",
      "args": [
        "run",
        "check:codex-tools"
      ],
      "evidence": "Закреплённые версии/определения инструментов Codex сверены; без команд модели."
    },
    {
      "required": false,
      "timeout_ms": 180000,
      "id": "architecture",
      "kind": "test",
      "executable": "npm",
      "args": [
        "run",
        "check:architecture"
      ],
      "evidence": "Нужный npm script создаётся в T003 на готовом анализаторе зависимостей; проверяет фасады, import boundaries и циклы; окончательный режим в T011."
    },
    {
      "required": false,
      "timeout_ms": 600000,
      "id": "migration-compatibility",
      "kind": "test",
      "executable": "node",
      "args": [
        "--test",
        "tests/migration-compatibility.test.mjs"
      ],
      "evidence": "Создаётся T007: проекты донора Kit 1.7.2, NONE/ACTIVE/DONE, upgrade/recovery/продолжение без сброса, чужая транзакция/assignment."
    },
    {
      "required": false,
      "timeout_ms": 600000,
      "id": "linux-platform",
      "kind": "test",
      "executable": "node",
      "args": [
        "--test",
        "tests/linux-runtime.test.mjs",
        "tests/linux-startup.test.mjs"
      ],
      "evidence": "Создаются T009: Linux process/service/file/startup adapters и ошибки. На Mac это fixture, не native Linux."
    },
    {
      "required": false,
      "timeout_ms": 600000,
      "id": "release-tooling",
      "kind": "test",
      "executable": "node",
      "args": [
        "--test",
        "tests/release-all.test.mjs",
        "tests/release-mac.test.mjs",
        "tests/release-linux.test.mjs"
      ],
      "evidence": "T010: матрица трёх ОС на fixtures, состав/исходники/manifest/установка/отказ; production build не выполняется."
    },
    {
      "required": false,
      "timeout_ms": 600000,
      "id": "three-platform-release",
      "kind": "package",
      "executable": "npm",
      "args": [
        "run",
        "build"
      ],
      "evidence": "Общая сборка текущей версии после DOCS: macOS arm64, Windows x64, Linux x64 из одного sourceCommit; архивы, комплект и manifest проверяются. Неполный комплект запрещён."
    },
    {
      "required": false,
      "timeout_ms": 600000,
      "id": "release-installed",
      "kind": "installed",
      "executable": "node",
      "args": [
        "scripts/check-installed-release.mjs",
        "--delivery"
      ],
      "evidence": "Готовый macOS-комплект проверен в корне проекта и /Applications: установлен либо оставлен pending при BACKEND_RUNNING; manifest, sourceCommit, подпись, runtime и неизменность старой копии подтверждены отдельно. Без пересборки и остановки службы."
    },
    {
      "required": false,
      "timeout_ms": 180000,
      "id": "github-release",
      "kind": "package",
      "executable": "node",
      "args": [
        "scripts/check-github-release.mjs"
      ],
      "evidence": "Собственный GitHub repo, remote main, тег v<version> на sourceCommit текущего manifest, полный набор assets по size/digest; без пересборки."
    },
    {
      "required": false,
      "timeout_ms": 180000,
      "id": "chatgpt-plugin",
      "kind": "test",
      "executable": "node",
      "args": [
        "--test",
        "tests/chatgpt-plugin.test.mjs"
      ],
      "evidence": "Полный HTML через настоящий MCP и SDK на изолированном host fixture; живую навигацию ChatGPT проверяет пользователь. Перед проверкой stage:chatgpt-plugin."
    },
    {
      "id": "native-startup-dock",
      "required": false,
      "kind": "test",
      "executable": "node",
      "args": [
        "--test",
        "tests/backend-launcher.test.mjs",
        "tests/backend-native-window.test.mjs",
        "tests/backend-upgrade.test.mjs",
        "tests/backend-owner-recovery.test.mjs",
        "tests/backend-diagnostics.test.mjs"
      ],
      "timeout_ms": 600000,
      "evidence": "Изолированные fixtures: запуск/повторный запуск, один owner, закрытие окна без остановки службы, маршруты native/HTTP. Dock реальной macOS подтверждает пользователь."
    },
    {
      "id": "native-startup-theme",
      "required": false,
      "kind": "test",
      "executable": "node",
      "args": [
        "--test",
        "tests/native-startup-theme.test.mjs",
        "tests/backend-native-pages.test.mjs",
        "tests/backend-native-window.test.mjs",
        "tests/desktop-client.test.mjs"
      ],
      "timeout_ms": 600000,
      "evidence": "Тест создаётся T003: тема и фон до первого показа, задержка/ошибка загрузки, закрытие во время ожидания, native/HTTP, сохранение живой страницы. Визуальную вспышку проверяет пользователь."
    },
    {
      "id": "plan-review-ui",
      "required": false,
      "kind": "test",
      "executable": "node",
      "args": [
        "--test",
        "tests/plan-review.test.mjs",
        "tests/sidebar.test.mjs"
      ],
      "timeout_ms": 600000,
      "evidence": "Проверка представления Review: отсутствие нормального PUBLISHED-текста/галочки/раунда, сохранение активных стадий, ошибок и переключателя; без реального Claude."
    }
  ],
  "budget": {
    "document_bytes": 28000,
    "hard_bytes": 180000
  },
  "documentation": {
    "mappings": []
  },
  "delivery_tail": [
    {
      "verification_kind": "package",
      "verification_ids": [
        "three-platform-release"
      ]
    },
    {
      "verification_kind": "installed",
      "verification_ids": [
        "release-installed"
      ]
    },
    {
      "verification_kind": "package",
      "verification_ids": [
        "github-release"
      ]
    }
  ]
}
